{
  "catalog_id": "baseline-component-catalog",
  "catalog_version": "1",
  "compatibility": {
    "architecture_profile_schema_versions": [
      "architecture-profile.v1"
    ],
    "deployer_runtime_versions": [
      "1"
    ],
    "deployment_specification_versions": [
      "resolved-deployment-specification.v1"
    ],
    "provider_profile_schema_versions": [
      "provider-implementation-profile.v1"
    ],
    "resolver_versions": [
      "1"
    ]
  },
  "components": [
    {
      "cleanup_contract_ref": {
        "id": "cleanup.baseline",
        "version": "1"
      },
      "compatibility": {
        "architecture_profile_versions": [
          {
            "id": "five-layer-baseline",
            "version": "1"
          }
        ],
        "deployment_specification_versions": [
          "resolved-deployment-specification.v1"
        ],
        "provider_profile_versions": [
          {
            "id": "provider-profile.aws.baseline",
            "version": "1"
          }
        ]
      },
      "component_kind": "storage_service",
      "component_version": "1",
      "configuration_schema_ref": {
        "id": "configuration.aws.archive-storage",
        "version": "1"
      },
      "deployment_component_id": "deployment.aws.archive-storage",
      "deployment_specification_bindings": [
        {
          "component_id": "l3_archive.aws.s3",
          "slot_id": "l3_archive_storage",
          "specification_schema_version": "resolved-deployment-specification.v1"
        }
      ],
      "error_contract_ref": {
        "id": "architecture-runtime-errors",
        "version": "1"
      },
      "extension_slot_refs": [],
      "formula_refs": [
        "formula.archive-storage"
      ],
      "input_ports": [
        {
          "cardinality": "many",
          "compatibility_version": "1",
          "envelope_ref": {
            "id": "contract-envelope",
            "version": "1"
          },
          "port_id": "catalog.aws.port.archive-storage.write-in",
          "producer_consumer_phase": "runtime",
          "resolution_stage": "deployer_output",
          "schema_ref": {
            "id": "normalized-telemetry",
            "version": "1"
          },
          "sensitivity": "internal",
          "value_type": "json_document"
        }
      ],
      "logical_component_ids": [
        "component.archive-storage"
      ],
      "observability_contract_ref": {
        "id": "observability.baseline",
        "version": "1"
      },
      "output_ports": [],
      "package_artifact_ref": {
        "id": "artifact.platform.aws.baseline",
        "version": "1"
      },
      "pricing_model_refs": [
        "pricing.aws.archive-storage"
      ],
      "provider": "aws",
      "required_permission_capabilities": [
        "permission.aws.archive-storage"
      ],
      "runtime_contract": {
        "memory_mb_max": 4096,
        "memory_mb_min": 128,
        "package_layout_id": "package-layout.platform-v1",
        "platform_handler_adapter_id": "handler-adapter.aws.baseline",
        "provider_runtime_id": "runtime.aws.managed",
        "timeout_seconds_max": 300,
        "timeout_seconds_min": 1,
        "trigger_adapter_id": "trigger-adapter.aws.baseline",
        "user_override_allowed": false
      },
      "service_id": "aws.archive-storage",
      "terraform_binding": {
        "allowed_input_variable_ids": [
          "input.aws.archive-storage.selection"
        ],
        "dependency_keys": [],
        "module_addresses": [],
        "outputs": [
          {
            "output_id": "output.aws.archive-storage.binding",
            "sensitive": false
          }
        ],
        "resource_addresses": [
          "aws_archive_storage.component"
        ]
      }
    },
    {
      "cleanup_contract_ref": {
        "id": "cleanup.baseline",
        "version": "1"
      },
      "compatibility": {
        "architecture_profile_versions": [
          {
            "id": "five-layer-baseline",
            "version": "1"
          }
        ],
        "deployment_specification_versions": [
          "resolved-deployment-specification.v1"
        ],
        "provider_profile_versions": [
          {
            "id": "provider-profile.aws.baseline",
            "version": "1"
          }
        ]
      },
      "component_kind": "storage_service",
      "component_version": "1",
      "configuration_schema_ref": {
        "id": "configuration.aws.cool-storage",
        "version": "1"
      },
      "deployment_component_id": "deployment.aws.cool-storage",
      "deployment_specification_bindings": [
        {
          "component_id": "l3_cool.aws.s3",
          "slot_id": "l3_cool_storage",
          "specification_schema_version": "resolved-deployment-specification.v1"
        }
      ],
      "error_contract_ref": {
        "id": "architecture-runtime-errors",
        "version": "1"
      },
      "extension_slot_refs": [],
      "formula_refs": [
        "formula.cool-storage"
      ],
      "input_ports": [
        {
          "cardinality": "many",
          "compatibility_version": "1",
          "envelope_ref": {
            "id": "contract-envelope",
            "version": "1"
          },
          "port_id": "catalog.aws.port.cool-storage.write-in",
          "producer_consumer_phase": "runtime",
          "resolution_stage": "deployer_output",
          "schema_ref": {
            "id": "normalized-telemetry",
            "version": "1"
          },
          "sensitivity": "internal",
          "value_type": "json_document"
        }
      ],
      "logical_component_ids": [
        "component.cool-storage"
      ],
      "observability_contract_ref": {
        "id": "observability.baseline",
        "version": "1"
      },
      "output_ports": [
        {
          "cardinality": "many",
          "compatibility_version": "1",
          "envelope_ref": {
            "id": "contract-envelope",
            "version": "1"
          },
          "port_id": "catalog.aws.port.cool-storage.transition-out",
          "producer_consumer_phase": "runtime",
          "resolution_stage": "deployer_output",
          "schema_ref": {
            "id": "normalized-telemetry",
            "version": "1"
          },
          "sensitivity": "internal",
          "value_type": "json_document"
        }
      ],
      "package_artifact_ref": {
        "id": "artifact.platform.aws.baseline",
        "version": "1"
      },
      "pricing_model_refs": [
        "pricing.aws.cool-storage"
      ],
      "provider": "aws",
      "required_permission_capabilities": [
        "permission.aws.cool-storage"
      ],
      "runtime_contract": {
        "memory_mb_max": 4096,
        "memory_mb_min": 128,
        "package_layout_id": "package-layout.platform-v1",
        "platform_handler_adapter_id": "handler-adapter.aws.baseline",
        "provider_runtime_id": "runtime.aws.managed",
        "timeout_seconds_max": 300,
        "timeout_seconds_min": 1,
        "trigger_adapter_id": "trigger-adapter.aws.baseline",
        "user_override_allowed": false
      },
      "service_id": "aws.cool-storage",
      "terraform_binding": {
        "allowed_input_variable_ids": [
          "input.aws.cool-storage.selection"
        ],
        "dependency_keys": [],
        "module_addresses": [],
        "outputs": [
          {
            "output_id": "output.aws.cool-storage.binding",
            "sensitive": false
          }
        ],
        "resource_addresses": [
          "aws_cool_storage.component"
        ]
      }
    },
    {
      "cleanup_contract_ref": {
        "id": "cleanup.baseline",
        "version": "1"
      },
      "compatibility": {
        "architecture_profile_versions": [
          {
            "id": "five-layer-baseline",
            "version": "1"
          }
        ],
        "deployment_specification_versions": [
          "resolved-deployment-specification.v1"
        ],
        "provider_profile_versions": [
          {
            "id": "provider-profile.aws.baseline",
            "version": "1"
          }
        ]
      },
      "component_kind": "storage_service",
      "component_version": "1",
      "configuration_schema_ref": {
        "id": "configuration.aws.hot-storage",
        "version": "1"
      },
      "deployment_component_id": "deployment.aws.hot-storage",
      "deployment_specification_bindings": [
        {
          "component_id": "l3_hot.aws.dynamodb",
          "slot_id": "l3_hot_storage",
          "specification_schema_version": "resolved-deployment-specification.v1"
        },
        {
          "component_id": "l3_hot.aws.reader_lambdas",
          "slot_id": "l3_hot_storage",
          "specification_schema_version": "resolved-deployment-specification.v1"
        }
      ],
      "error_contract_ref": {
        "id": "architecture-runtime-errors",
        "version": "1"
      },
      "extension_slot_refs": [],
      "formula_refs": [
        "formula.hot-storage"
      ],
      "input_ports": [
        {
          "cardinality": "many",
          "compatibility_version": "1",
          "envelope_ref": {
            "id": "contract-envelope",
            "version": "1"
          },
          "port_id": "catalog.aws.port.hot-storage.write-in",
          "producer_consumer_phase": "runtime",
          "resolution_stage": "deployer_output",
          "schema_ref": {
            "id": "normalized-telemetry",
            "version": "1"
          },
          "sensitivity": "internal",
          "value_type": "json_document"
        }
      ],
      "logical_component_ids": [
        "component.hot-storage"
      ],
      "observability_contract_ref": {
        "id": "observability.baseline",
        "version": "1"
      },
      "output_ports": [
        {
          "cardinality": "many",
          "compatibility_version": "1",
          "envelope_ref": {
            "id": "contract-envelope",
            "version": "1"